时间,标题,简讯,date
2024-10-24 01:22:00,苹果发布了新的人工智能预览版 包括ChatGPT集成,【苹果发布了新的人工智能预览版 包括ChatGPT集成】财联社10月24日电，当地时间周三，苹果发布了一系列苹果智能功能的测试版，包括期待已久的ChatGPT集成。今年夏天，该公司宣布了对人工智能热潮的回应，但在向用户推出其AI功能方面动作缓慢。投资者希望人工智能功能将刺激iPhone升级浪潮，因为这些工具只能在较新的设备上可用。,2024-10-24
2024-10-23 23:24:32,现货白银日内跌超4%,【现货白银日内跌超4%】财联社10月23日电，现货白银日内跌超4%，现报33.41美元/盎司。COMEX期银日内大跌4%，现报33.62美元/盎司。,2024-10-24
2024-10-23 22:54:24,志特新材：前三季度净利润同比增长17893%,【志特新材：前三季度净利润同比增长17893.02%】财联社10月23日电，志特新材发布2024年第三季度报告，公司前三季度实现营业收入18.05亿元，同比增长13.40%；净利润5933万元，同比增长17893.02%。其中，第三季度实现净利润5176万元，同比增长246.99%。,2024-10-24
2024-10-23 22:49:17,习近平会见印度总理莫迪：双方同意从战略高度和长远角度看待和处理中印关系 不让具体分歧影响两国关系大局,"【习近平会见印度总理莫迪：双方同意从战略高度和长远角度看待和处理中印关系 不让具体分歧影响两国关系大局】当地时间10月23日，国家主席习近平在喀山出席金砖国家领导人会晤期间会见印度总理莫迪。习近平指出，中国和印度同为文明古国、发展中大国、全球南方重要成员，都处在各自国家现代化建设的关键时期。中印正确把握历史潮流和两国关系发展方向，符合两国和两国人民根本利益。双方应该加强沟通合作，增进战略互信，相互成就彼此发展梦想。双方也要肩负起国际责任，为广大发展中国家联合自强作出表率，为推动世界多极化、国际关系民主化作出贡献。

习近平强调，中印关系本质是两个14亿多人口的相邻发展中大国如何相处的问题。发展",2024-10-24
2024-10-23 22:39:48,习近平会见伊朗总统佩泽希齐扬：中方对当前中东地区局势深感忧虑 尽早实现加沙停火止战是缓和地区局势紧张的关键,【习近平会见伊朗总统佩泽希齐扬】当地时间10月23日下午，国家主席习近平在喀山出席金砖国家领导人会晤期间会见伊朗总统佩泽希齐扬。,2024-10-24
2024-10-23 22:33:17,EIA原油库存增幅高于预期 WTI原油期货跌超1%,【EIA原油库存增幅高于预期 WTI原油期货跌超1%】财联社10月23日电，WTI原油期货快速下挫跌超1%。报告显示，美国至10月18日当周EIA原油库存增加547.4万桶，预期增加27万桶，前值为减少219.1万桶。,2024-10-24
2024-10-23 22:30:34,,美国至10月18日当周EIA原油库存增加547.4万桶，预期增加27万桶，前值为减少219.1万桶。,2024-10-24
2024-10-23 22:23:15,,财联社10月23日电，现货白银跌超3%，现报33.68美元/盎司。,2024-10-24
2024-10-23 22:08:52,恒逸石化：拟以1.25亿元-2.5亿元专项贷款及自有资金回购股份,【恒逸石化：拟以1.25亿元-2.5亿元专项贷款及自有资金回购股份】财联社10月23日电，恒逸石化公告，拟定1.25亿元-2.5亿元回购股份，回购价格不超过9.00元/股。回购用途拟将回购股份用于实施员工持股计划或股权激励。回购资金来源为公司自有资金及股票回购专项贷款资金。截至本公告披露日，公司已与中国农业银行股份有限公司授权分支机构签署了《流动资金借款合同》，借款金额不超过1.32亿元（含本数），借款利率不超过1.75%（含本数），借款用途为回购公司股票，借款期限为3年。,2024-10-24
2024-10-23 22:06:57,美利信：拟通过全资子公司收购VOIT Automotive GmbH和Voit Polska Sp. Z o.o.股权,【美利信：拟通过全资子公司收购VOIT Automotive GmbH和Voit Polska Sp. Z o.o.股权】财联社10月23日电，美利信公告，公司拟通过全资子公司香港美利信在卢森堡设立特殊目的公司（SPV），以现金方式收购VOIT Automotive GmbH 97%股权以及Voit Polska Sp. Z o.o. 100%股权。本次交易将进一步扩大公司在汽车零部件领域的布局，提升公司的盈利能力和市场竞争力。本次交易构成上市公司重大资产重组。,2024-10-24
