时间,标题,简讯,date
2024-10-24 17:40:23,万业企业：出售所持富乐德A股股票329.87万股 成交金额1.97亿元,【万业企业：出售所持富乐德A股股票329.87万股 成交金额1.97亿元】财联社10月24日电，万业企业公告，公司通过集中竞价交易方式，出售所持富乐德A股股票共计329.87万股，占其总股本的0.97%，成交均价为59.57元/股，成交金额为1.97亿元（不含印花税、交易佣金等交易费用）。本次出售后，公司尚持有富乐德605.13万股的股票，占其总股本的比例为1.79%。公司表示，本次出售股票资产的事项有利于优化公司资产结构，提高资产流动性及运营效率。,2024-10-24
2024-10-24 17:26:19,恒玄科技：前三季度净利润2.89亿元 同比增长145.47%,【恒玄科技：前三季度净利润2.89亿元 同比增长145.47%】财联社10月24日电，恒玄科技发布2024年第三季度报告，公司前三季度实现营业收入24.73亿元，同比增长58.12%；归属于上市公司股东的净利润2.89亿元，同比增长145.47%。其中，第三季度实现营业收入9.42亿元，同比增长44.01%，创单季度营收新高；净利润1.41亿元，同比增长106.45%。公司净利润大幅增长主要由于营业收入快速增长带来规模效应，期间费用率降低，以及销售毛利率持续提升。,2024-10-24
2024-10-24 17:11:42,春秋电子：前三季度净利润1.41亿元 同比增长1268%,【春秋电子：前三季度净利润1.41亿元 同比增长1268%】财联社10月24日电，春秋电子发布2024年第三季度报告，前三季度公司实现营业收入29.82亿元，同比增长27.73%；归属于上市公司股东的净利润1.41亿元，同比增长1268.19%。其中，第三季度实现营业收入11.05亿元，同比增长20.40%；归属于上市公司股东的净利润1.14亿元，同比增长346.19%。,2024-10-24
2024-10-24 17:11:25,六部门：符合要求的再生铜铝原料不属于固体废物 可自由进口,【六部门：符合要求的再生铜铝原料不属于固体废物 可自由进口】六部门发布关于规范再生铜及铜合金原料、再生铝及铝合金原料进口管理有关事项的公告。符合附表要求的再生铜铝原料不属于固体废物，可自由进口。附表中不同种类的再生铜铝原料不允许混装，报关时同一报关单下不允许申报不同种类的再生铜铝原料；不同类别的散装再生铜铝原料不允许混装，当不同类别的再生铜铝原料有独立包装时可以混装，但应分类放置。,2024-10-24
2024-10-24 17:07:42,珀莱雅：前三季度净利润同比增长33.95%,【珀莱雅：前三季度净利润同比增长33.95%】财联社10月24日电，珀莱雅公告，前三季度实现营业收入69.66亿元，同比增长32.72%；净利润9.99亿元，同比增长33.95%。公司表示，业绩增长主要系线上渠道营收增长以及小品牌稳步增长。,2024-10-24
2024-10-24 16:54:16,恒瑞医药：前三季度净利润同比增长32.98%,【恒瑞医药：前三季度净利润同比增长32.98%】财联社10月24日电，恒瑞医药公告，前三季度实现营业收入201.89亿元，同比增长18.67%；净利润46.2亿元，同比增长32.98%。,2024-10-24
2024-10-24 16:51:04,新易盛：2024年第三季度净利润7.81亿元 同比增长453%,【新易盛：2024年第三季度净利润7.81亿元 同比增长453.07%】财联社10月24日电，新易盛公告，2024年第三季度归属于母公司所有者的净利润7.81亿元，同比增长453.07%。,2024-10-24
2024-10-24 16:47:18,捷捷微电：前三季度净利润同比增长133.37%,【捷捷微电：前三季度净利润同比增长133.37%】财联社10月24日电，捷捷微电公告，公司前三季度实现营业收入20.06亿元，同比增长40.63%；归属于上市公司股东的净利润3.33亿元，同比增长133.37%。,2024-10-24
2024-10-24 16:43:53,吉比特：第三季度净利润同比下降23.82% 拟10派20元,【吉比特：第三季度净利润同比下降23.82% 拟10派20元】财联社10月24日电，吉比特公告，2024年第三季度公司实现营业收入8.59亿元，同比下降10.36%；归属于上市公司股东的净利润为1.4亿元，同比下降23.82%。前三季度累计营业收入为28.18亿元，同比下降14.77%；归属于上市公司股东的净利润为6.58亿元，同比下降23.48%。公司主要收入来源于自研游戏产品，其中《问道》端游收入有所增加，而《问道手游》和《一念逍遥》收入均减少。吉比特同日公告，公司拟向全体股东每10股派发现金红利20.00元（含税）。,2024-10-24
2024-10-24 16:30:28,模塑科技：公司董事长兼总经理收到《取保候审决定书》,【模塑科技：公司董事长兼总经理收到《取保候审决定书》】财联社10月24日电，模塑科技公告，公司董事长兼总经理曹克波因涉嫌违规披露、不披露重要信息罪，收到无锡市人民检察院出具的《取保候审决定书》。所涉违规披露事项与公司2022年12月被中国证券监督管理委员会江苏监管局行政处罚系同一事项。,2024-10-24
2024-10-24 16:27:49,汇顶科技：前三季度净利润4.48亿元 同比增长3499%,【汇顶科技：前三季度净利润4.48亿元 同比增长3499.3%】财联社10月24日电，汇顶科技发布2024年第三季度报告，前三季度实现营业收入32.23亿元，同比增长0.82%；净利润4.48亿元，同比增长3499.30%；基本每股收益0.98元。其中，第三季度实现营业收入9.67亿元，同比下降17.71%；净利润1.31亿元，同比下降11.82%。公司表示，主要系公司聚焦于自身优势明显且市场前景可观的研发项目，持续提升研发效率及加强销售、管理费用管控所致。,2024-10-24
2024-10-24 16:27:35,秋冬流感疫苗接种潮蔓延 进口疫苗“缺位” 部分国产疫苗价格击穿成本线,【秋冬流感疫苗接种潮蔓延 进口疫苗“缺位” 部分国产疫苗价格击穿成本线】随着天气转凉，流感疫苗的接种潮逐步来临。财联社记者近日调研、采访发现，目前流感疫苗接种热度“由南向北”呈梯度递增态势，截至10月初，流感疫苗批签发数量已超去年。疫苗品种方面，此前暂停供应的赛诺菲巴斯德疫苗已在基层医疗机构消失，国产流感疫苗补位，供应暂未出现紧张情况。另外，今年国产流感疫苗价格战非常激烈，三价、四价流感疫苗价格或为历年最低，有疫苗上市公司内部人士表示部分流感疫苗价格“已经击穿成本线”。（财联社记者 卢阿峰）,2024-10-24
2024-10-24 16:23:31,习近平：全球南方群体性崛起是世界大变局的鲜明标志,习近平：“全球南方”群体性崛起，是世界大变局的鲜明标志。“全球南方”国家共同迈向现代化是世界历史上一件大事，也是人类文明进程中史无前例的壮举。,2024-10-24
2024-10-24 16:21:49,3连板科源制药：前三季度净利润同比下降40.38%,【3连板科源制药：前三季度净利润同比下降40.38%】财联社10月24日电，科源制药公告，前三季度实现营业收入3.31亿元，同比下降2.88%；归属于上市公司股东的净利润3968.31万元，同比下降40.38%。,2024-10-24
2024-10-24 15:59:27,商务部回应美国宣布制裁两家中国实体,【商务部回应美国宣布制裁两家中国实体】财联社10月24日电，商务部10月24日召开例行新闻发布会。有记者提问，近日，美国宣布制裁参与开发、生产及运输俄罗斯远程攻击无人机的两家中国实体和一家俄罗斯实体。请问发言人对此有何评论？商务部新闻发言人何亚东表示，中国对军品和军民两用品出口都有严格管制措施，要求企业依法合规开展相关管制物项的国际贸易。乌克兰危机以来，中方多次发布无人机相关管制公告，且明确规定未管制的民用无人机不得违规用于军事目的。相关部门依法加强管制无人机出口许可审核，并加大对违法出口的稽查力度。中方坚决反对没有国际法依据和联合国安理会授权的单边制裁和“长臂管辖”。对于任何以涉俄为由恶意打,2024-10-24
2024-10-24 15:53:34,商务部：针对美国PVH集团不可靠实体清单调查正依法有序推进,【商务部：针对美国PVH集团不可靠实体清单调查正依法有序推进】财联社10月24日电，商务部10月24日召开例行新闻发布会。有记者提问，请问PVH调研结果如何？是否会将其列入不可靠实体清单？之后会有什么后果？商务部新闻发言人何亚东表示，不可靠实体清单工作机制正在依法有序推进针对美国PVH集团的调查工作。调查期间，我们将充分保护PVH集团陈述、申辩权利。之后，工作机制将依照《不可靠实体清单规定》，根据调查情况，作出相应决定。中方一贯审慎处理不可靠实体清单问题，仅针对极少数破坏市场规则并违反中国法律的外国实体，诚信守法的外国实体完全无需担心。中国政府一如既往地欢迎世界各国企业来华投资兴业，并致力于为,2024-10-24
2024-10-24 15:40:08,赛微微电：询价转让价格为38元/股,【赛微微电：询价转让价格为38元/股】财联社10月24日电，赛微微电公告，根据2024年10月24日询价申购情况，初步确定的本次询价转让价格为38元/股。参与本次询价转让报价的机构投资者家数为3家，涵盖了基金管理公司、私募基金管理人等专业机构投资者。本次询价转让拟转让股份已获全额认购，初步确定受让方为3家机构投资者，拟受让股份总数为175.84万股。,2024-10-24
2024-10-24 15:34:22,浙江医药：第三季度净利润同比增长1738%,【浙江医药：第三季度净利润同比增长1737.57%】财联社10月24日电，浙江医药发布2024年第三季度报告，公司前三季度实现营业收入71.13亿元，同比增长21.04%；归属于上市公司股东的净利润8.5亿元，同比增长181.96%；基本每股收益0.88元。其中，第三季度实现营业收入27.07亿元，同比增长39.66%；归属于上市公司股东的净利润5.34亿元，同比增长1737.57%。主要系公司主导产品维生素E、维生素A销量和价格上涨所致。,2024-10-24
2024-10-24 15:27:17,10月24日涨停分析,【10月24日涨停分析】今日共99股涨停，连板股总数24只，28股封板未遂，封板率为78%（不含ST股、退市股）。焦点股方面，双成药业开盘“反核”成功，走出地天板，斩获25天22板；高位股尾盘大幅拉升，海能达率先封板录得21天17板，华立股份上演地天板走出10连板，常山北明反包涨停。,2024-10-24
2024-10-24 15:02:24,收评：创业板指低开低走跌1.37% 两市成交额缩至1.5万亿,【收评：创业板指低开低走跌1.37% 两市成交额缩至1.5万亿】财联社10月24日电，市场全天低开低走，创业板指领跌。北证50指数涨超4%，盘中一度再创历史新高。沪深两市全天成交额1.52万亿，较上个交易日缩量4063亿。盘面上，ST板块逆势大涨，*ST开元、ST恒久、ST柯利达、ST加加、ST沪科等30余股涨停。NMN、维生素概念股表现活跃，雅本化学、兄弟科技、圣达生物、金达威涨停。并购重组概念股维持强势，电投产融、华立股份、大唐电信、松发股份等20余股涨停。半导体板块震荡反弹，富乐德、锴威特、上海贝岭涨停。下跌方面，风电、光伏板块展开调整，双一科技、晶澳科技等跌超5%。整体上个股跌多涨少，,2024-10-24
2024-10-24 14:56:10,四川长虹、成都路桥等多只高位股尾盘直线拉升,【多只高位股展开反核 四川长虹直线拉升逼近涨停】财联社10月24日电，尾盘多只高位股展开反核，一度跌超8%的四川长虹直线拉升逼近涨停，华立股份上演地天板走出10连板，常山北明反包涨停，此前海能达走出21天17板，宗申动力、成都路桥等快速冲高。,2024-10-24
2024-10-24 14:51:00,沪深两市缩量超4000亿,【沪深两市缩量超4000亿】财联社10月24日电，据财联社盯盘数据显示，临近收盘，沪深两市成交额较昨日此时缩量超4000亿，现成交超1.45万亿。,2024-10-24
2024-10-24 14:50:37,,财联社10月24日电，氧化铝期货主力合约涨超4%，报5115元/吨，续创历史新高。,2024-10-24
2024-10-24 14:47:43,,财联社10月24日电，玻璃期货主力合约持续拉升大涨超7%，报1352元/吨。,2024-10-24
2024-10-24 14:38:07,2024年医保目录现场谈判/竞价拟于10月27日—30日在北京开展 预计11月份公布调整结果,【2024年医保目录现场谈判/竞价拟于10月27日—30日在北京开展 预计11月份公布调整结果】从国家医保局获悉，根据工作安排，2024年医保目录现场谈判/竞价拟于10月27日—30日在北京开展，预计11月份公布调整结果，新版药品目录将于2025年1月1日起实施。此前，按照《2024年国家医保药品目录调整工作方案》，从7月1日正式启动国家医保局成立以来的第7次国家医保药品目录调整，经形式审查、专家评审、结果确认，共有162个通用名药品确认参加谈判/竞价。近期，组织医保管理、药物经济学等方面的专家，分别重点从职工/居民医保基金影响和药物经济学评价等方面对拟谈判/竞价药品开展测算。其间，组织专家代,2024-10-24
2024-10-24 13:55:22,三大指数均跌逾1% 下跌个股近3700只,【沪指跌逾1%】财联社10月24日电，指数走弱，沪指下挫跌逾1.00%，深成指跌1.52%，创业板指跌1.47%，拼多多概念、Kimi概念、国防军工等板块指数跌幅居前，干细胞、并购重组、维生素等板块指数涨幅居前。,2024-10-24
2024-10-24 13:42:56,完成首笔交易 国泰君安用互换便利借贷资金增持股票,【完成首笔交易 国泰君安用互换便利借贷资金增持股票】财联社10月24日电，国泰君安10月24日利用“证券、基金、保险公司互换便利（SFISF）”借贷资金顺利完成增持股票的首笔交易。在此之前，国泰君安于21日与中债信用增进公司签署《债券借贷协议》；22日完成互换便利业务全市场首单国债换入交易；23日完成互换便利业务全市场首批国债质押式回购交易。,2024-10-24
2024-10-24 12:35:54,10只中证A500ETF上市7日份额接近翻倍至400亿,【10只中证A500ETF上市7日份额接近翻倍至400亿】上市仅7个交易日，首批10只中证A500ETF规模已经接近翻倍。数据显示，10只中证A500ETF最新份额合计396.66亿份，规模达到390.04亿元，较上市之初的200亿增幅分别达到98%、95%。其中，国泰中证A500ETF成为中证A系列指数中首个百亿ETF，增幅超400%。景顺长城中证A500ETF份额突破40亿，此外，南方、摩根资产管理以及银华、华泰柏瑞、招商旗下中证中证A500ETF规模也突破30亿。（财联社记者 闫军）,2024-10-24
2024-10-24 11:44:02,10月24日午间涨停分析,【10月24日午间涨停分析】财联社10月24日电，今日午盘全市场共72股涨停，连板股总数12只，27股封板未遂，封板率为73%（不含ST股、退市股）。焦点股方面，高位股剧烈博弈，双成药业走出地天板行情，录得25天22板；而并购重组概念人气股华东重机早盘则一度跳水跌停，上演天地板。,2024-10-24
2024-10-24 11:33:04,午评：北证50指数涨超6%再创历史新高 ST板块逆势大涨,【午评：北证50指数涨超6%再创历史新高 ST板块逆势大涨】财联社10月24日电，市场早盘震荡调整，深成指领跌。北证50指数涨超6%再创历史新高。盘面上，ST板块逆势大涨，*ST开元、ST恒久、ST柯利达、ST加加、ST沪科等近30股涨停。维生素、NMN概念股开盘冲高，科源制药、圣达生物、金达威涨停。半导体板块震荡反弹，富乐德、上海贝岭涨停。CPO、算力概念股盘中异动，天孚通信创历史新高，亚康股份、永鼎股份涨停。下跌方面，风电、光伏板块展开调整，双一科技、晶澳科技等跌超5%。总体上个股跌多涨少，全市场超2800只个股下跌。沪深两市半日成交额1万亿，较上个交易日缩量1291亿。板块方面，NMN概,2024-10-24
2024-10-24 11:30:53,沪深两市成交额突破1万亿 较昨日此时缩量超1300亿,【沪深两市成交额突破1万亿 较昨日此时缩量超1300亿】财联社10月24日电，据财联社盯盘数据显示，沪深两市成交额突破1万亿，较昨日此时缩量超1300亿。,2024-10-24
2024-10-24 11:16:15,北证50涨超6% 再度刷新历史新高,【北证50涨超6% 再度刷新历史新高】财联社10月24日电，北交所个股持续活跃，北证50指数涨超6%，再度刷新历史新高。华岭股份、七丰精工等涨停，旭杰科技、艾能聚等十余股涨超20%。,2024-10-24
2024-10-24 11:08:38,双成药业上演地天板行情 走出25天22板,【双成药业上演地天板行情 走出25天22板】财联社10月24日电，今早跌停开盘的高位人气股双成药业拉升涨停，上演地天板行情，走出25天22板，成交27亿元。,2024-10-24
2024-10-24 09:42:37,深成指跌逾1% 三市下跌个股近3700只,【深成指跌逾1%】财联社10月24日电，指数走弱，深成指下挫跌逾1.00%，沪指跌0.71%，创业板指跌0.91%，拼多多概念、征信、制冷剂等板块指数跌幅居前，维生素、干细胞、合成生物等板块指数涨幅居前。,2024-10-24
2024-10-24 09:35:49,两只上市新股N六九、N天脉涨幅收窄至530% 触发临时停牌,【两只上市新股N六九、N天脉涨幅收窄至530% 触发临时停牌】财联社10月24日电，今日上市两只新股N六九、N天脉盘初快速跳水，涨幅收窄至530%，触发临时停牌，今早两股双双高开800%。,2024-10-24
2024-10-24 09:33:04,华东重机直线跳水跌停 上演天地板,【华东重机直线跳水跌停 上演天地板】财联社10月24日电，并购重组概念人气股华东重机直线跳水跌停，上演天地板行情，成交近5亿元。此前该股走出4连板，今早以涨停开盘。,2024-10-24
2024-10-24 09:27:15,竞价看龙头,【竞价看龙头】财联社10月24日电，市场焦点股海能达（20天16板）高开9.92%，并购重组的华立股份（9板）低开10.01%、光智科技（创业板8板）低开4.05%，川渝本地股成都路桥（8板）竞价涨停、四川长虹（6板）平开，光伏板块川润股份（13天8板）高开7.63%、海源复材（2板）高开5.43%，跨境支付概念股青岛金王（9天7板）高开7.34%，芯片产业链的华东重机（12天7板）竞价涨停、富乐德（创业板5板）竞价涨停，英伟达概念股麦格米特（4板）低开0.62%。,2024-10-24
2024-10-24 09:26:35,三大指数集体低开,【三大指数集体低开】财联社10月24日电，沪指低开0.45%，深成指低开0.64%，创业板指低开0.82%，胎压监测、维生素、铁矿石等板块指数涨幅居前，玻尿酸、拼多多概念、Kimi概念等板块指数跌幅居前。,2024-10-24
2024-10-24 09:20:49,恒生指数开盘跌0.89%,财联社10月24日电，香港恒生指数开盘跌0.89%。恒生科技指数跌1.35%。,2024-10-24
2024-10-24 08:09:51,消息称字节跳动2024年营收增幅和利润率双双下降,"
【字节跳动2024年营收增幅和利润率双双下降】财联社10月24日电，从接近字节跳动的知情人士获悉，2024年前三季度，该公司的收入增速出现较大幅度的下降。此外，其利润率在“去肥增瘦”获得短暂提升之后，重新进入了下滑通道。数据的背后，反映了字节跳动正在遭遇的三重挑战：国内广告收入引擎降速；地缘政治对TikTok营收的影响开始显现；而大模型行业正处于早期的高投入阶段，短期看不到回报。",2024-10-24
2024-10-24 08:01:01,财联社10月24日早间新闻精选,"【财联社10月24日早间新闻精选】
1、工信部总工程师赵志国昨日在新闻发布会上表示，下一步，培育壮大低空经济、商业航天、生物制造等新产业新赛道。赵志国还表示，要多措并举扩大汽车消费，新启动一批公共领域车辆全面电动化试点。
2、《党建研究》日前刊发国务院国资委党委署名文章称，超前布局、梯次培育量子科技、核聚变、生物制造、6G等未来产业，加快打造一批具有国际竞争力的战略性新兴产业集群和产业领军企业。",2024-10-24
2024-10-24 07:41:45,投资日历：周四资本市场大事提醒,"【投资日历：周四资本市场大事提醒】
①今日共有2只新股上市，为创业板的六九一二（301592）、创业板的苏州天脉（301626）。
②商务部将于10月24日召开10月第2次例行新闻发布会。
③第三届北斗规模应用国际峰会将于10月24日在株洲举办。
④2024中国国际数字经济博览会将于10月24日至26日在石家庄举办。
⑤2024宁德时代超级增混电池品牌暨新品发布会将于10月24日举行。
⑥小鹏第二代人形机器人将于10月24日科技日亮相。
⑦由华为举办的2024全球人才发展峰会议将于深圳召开。
⑧科大讯飞将于10月24日举办2024第七届世界声博会暨科大讯飞全球1024开发者节。
⑨OPPO将于",2024-10-24
2024-10-24 06:34:17,周四你需要知道的隔夜全球要闻,"【周四你需要知道的隔夜全球要闻】
1、特斯拉盘后发布的财报显示，第三季度盈利超预期，马斯克在业绩电话会议上预测明年特斯拉汽车销量将增长20%-30%，该公司股价周三在盘后交易中一度飙升逾12%。
2、美股周三收跌，半导体、科技股拖累纳指跌1.6%，道指跌0.96%，标普500指数跌0.92%。欧洲股市普遍收跌，德国DAX指数跌0.23%。
3、加拿大央行降息50个基点，将基准利率从4.25%降至3.75%，符合市场预期，为连续第四次降息。
4、美联储褐皮书显示，总体而言，自9月初以来，几乎所有地区的经济活动都基本没有变化，只有里士满和芝加哥两个区域略有增长，大多数地区的制造业活动有所下降。
5",2024-10-24
2024-10-24 05:38:55,,特斯拉股价盘后大涨超10%，财报显示特斯拉第三季度盈利超预期，马斯克预测明年特斯拉汽车销量增长20%-30%。,2024-10-24
2024-10-24 05:38:08,马斯克：预计明年特斯拉汽车销量增长20%-30%,财联社10月24日电，马斯克预测明年特斯拉汽车销量增长20%-30%。,2024-10-24
2024-10-24 04:07:15,,财联社10月24日电，特斯拉股价盘后上涨5%，此前第三财季调整后每股收益超出预期。,2024-10-24
2024-10-24 04:04:35,特斯拉第三财季调整后每股收益高于预期 有望在2025年发布经适型车型,财联社10月24日电，特斯拉第三财季营收251.8亿美元，分析师预期254.3亿美元。,2024-10-24
2024-10-24 04:01:01,热门中概股多数下跌 纳斯达克中国金龙指数跌超1%,【热门中概股多数下跌 纳斯达克中国金龙指数跌超1%】财联社10月24日电，热门中概股多数下跌，纳斯达克中国金龙指数跌1.20%。拼多多跌超4%，富途控股跌超3%，阿里巴巴、百度跌超2%，爱奇艺、腾讯音乐、满帮、微博、网易跌超1%，京东、蔚来、哔哩哔哩小幅下跌。理想汽车涨超3%，小鹏汽车涨超1%，唯品会小幅上涨。,2024-10-24
2024-10-24 04:00:46,美股三大指数集体收跌 半导体、科技股拖累纳指跌1.6%,【美股三大指数集体收跌 半导体、科技股拖累纳指跌1.6%】财联社10月24日电，美股三大指数集体收跌，道指跌0.96%，纳指跌1.60%，标普500指数跌0.92%。芯片股普跌，ARM跌近7%，高通、博通跌逾3%，英伟达、美光科技跌近3%，英特尔、阿斯麦跌近2%。大型科技股全线走低，Meta跌超3%，苹果、亚马逊跌逾2%，特斯拉跌近2%。麦当劳跌超5%，美国多地麦当劳发生严重的大肠杆菌感染事故。,2024-10-24
2024-10-24 02:03:30,美联储“褐皮书”：美多数地区制造业活动有所下降,财联社10月24日电，美联储褐皮书显示，总体来看，自九月初以来，几乎所有地区的经济活动变化不大，不过有两个地区报告了适度增长。,2024-10-24
2024-10-24 01:52:17,,财联社10月24日电，美股跌幅扩大，纳指跌超2%。,2024-10-24
2024-10-24 01:42:16,苹果即将生产配备M4芯片的新款MacBook air 并计划推出新款低端iPad,财联社10月24日电，据知情人士透露，苹果公司即将生产配备M4芯片的新款MacBook air，并将于2025年初发布。,2024-10-24
2024-10-24 01:37:21,土耳其防长：首都工厂遭袭是库尔德工人党所为,【土耳其防长：首都工厂遭袭是库尔德工人党所为】财联社10月24日电，土耳其国防部长亚沙尔·居莱尔当地时间10月23日抵达土耳其航空航天工业公司遇袭工厂，居莱尔明确指出库尔德工人党是这次袭击的幕后黑手。居莱尔强烈谴责了库尔德工人党的暴力行为，并誓言将继续对该组织采取严厉打击。“我们正在惩罚这些库尔德工人党，但他们依然不知悔改。我再次重申，直到最后一名恐怖分子被消灭，我们绝不会放过他们，我们将让他们为所作所为付出代价，所有人都会看到这一点。”,2024-10-24
