时间,标题,简讯,date
2024-05-31 03:56:54,苹果计划对Siri进行全面改革,【苹果计划对siri进行全面改革】财联社5月31日电，苹果计划对siri进行全面改革，让用户更好地控制应用程序，这将是其重新进军人工智能领域的核心内容，苹果希望夺回亚马逊Alexa和谷歌助手的地盘。,2024-05-31
2024-05-31 03:35:10,,财联社5月31日电，OpenAI将重新启动之前被放弃的机器人团队。,2024-05-31
2024-05-31 02:09:57,,财联社5月31日电，沙特阿拉伯将出售15.45亿股沙特阿美股份。,2024-05-31
2024-05-31 01:56:32,哈马斯：愿在以色列停止进攻加沙情况下达成“全面协议”,【哈马斯：愿在以色列停止进攻加沙情况下达成“全面协议”】财联社5月31日电，巴勒斯坦伊斯兰抵抗运动（哈马斯）5月30日晚发表声明说，哈马斯愿在以色列停止进攻加沙地带的情况下与以方达成“全面协议”。,2024-05-31
2024-05-31 00:22:40,美联储威廉姆斯：并不需要通胀达到2%才降息,财联社5月31日电，美联储威廉姆斯表示，不知道何时降息，将取决于数据表现。,2024-05-31
2024-05-31 00:05:52,美联储威廉姆斯：有充分证据表明货币政策具有限制性,财联社5月31日电，美联储威廉姆斯表示，有充分证据表明货币政策具有限制性。,2024-05-31
2024-05-31 00:00:08,,财联社5月31日电，美股标普500指数恢复报价，现跌0.41%。,2024-05-31
2024-05-30 23:55:49,美股道琼斯工业平均指数恢复报价,财联社5月30日电，道琼斯工业平均指数恢复报价。,2024-05-31
2024-05-30 23:47:29,,财联社5月30日电，芝加哥商品交易所确认目前没有产生任何指数定价。,2024-05-31
2024-05-30 23:29:02,,财联社5月30日电，标普指数网站称正在进行维护。,2024-05-31
2024-05-30 23:23:13,标普500指数和道指自北京时间22:41开始无实时报价,财联社5月30日电，若干用户报告称，标普500指数和道琼斯工业平均指数自北京时间22:41（美东时间10:41）开始就没有实时报价。,2024-05-31
2024-05-30 23:15:15,消息人士：欧佩克+讨论将自愿减产措施维持到年底,财联社5月30日电，消息人士透露，欧佩克+正在讨论将自愿减产措施维持到年底。,2024-05-31
2024-05-30 22:39:39,*ST中捷：撤销退市风险警示 周五停牌一天,【*ST中捷：撤销退市风险警示 明日停牌】财联社5月30日电，*ST中捷公告，公司股票交易自2024年6月3日（星期一）开市起撤销退市风险警示及其他风险警示，股票简称由“*ST 中捷”变更为“中捷资源”。公司股票交易将于2024年5月31日（星期五）停牌一天，并于2024年6月3日（星期一）开市起复牌。,2024-05-31
2024-05-30 22:28:21,3连板航天晨光：商业航天领域产品收入占比相对较小,【3连板航天晨光：商业航天领域产品收入占比相对较小】财联社5月30日电，航天晨光发布股票交易风险提示公告，公司主营业务涉及智能制造、核工装备、后勤保障、柔性管件、环保装备、压力容器等板块，产品主要应用于石油化工、水利水电、核电、环卫、能源装备等领域。部分产品应用于商业航天领域，目前收入占比相对较小，未来形成规模性效益还具有不确定性。公司收入结构短期内不会发生重大变化。敬请广大投资者注意投资风险。,2024-05-31
